"DESCRIPTION","DURATION IN MS","NAME","PARENT SUITE","START TIME","STATUS","STOP TIME","SUB SUITE","SUITE","TEST CLASS","TEST METHOD"
"Test basic functionality of database relation interface.","260996","test_database_relation_with_charm_libraries","tests.integration.relations.pgbouncer_provider","2026-06-10","passed","2026-06-10","","test_pgbouncer_provider","",""
"Check these relations all work when scaling pgbouncer.","150245","test_scaling","tests.integration.relations.pgbouncer_provider","2026-06-10","passed","2026-06-10","","test_pgbouncer_provider","",""
"Rejoins the TLS relation and check through the test app the it is on.

    Args:
        ops_test: The ops test framework
    ","34111","test_add_tls","tests.integration","2026-06-10","passed","2026-06-10","","test_tls","",""
"Simple test to ensure that the PostgreSQL and application charms get deployed.","292608","test_deploy_stable","tests.integration","2026-06-10","passed","2026-06-10","","test_upgrade_from_stable","",""
"","65621","test_deploy_at_scale","tests.integration.relations","2026-06-10","passed","2026-06-10","","test_peers","",""
"Test that we can exit relations with multiple units without breaking anything.","68892","test_exit_relations","tests.integration.relations","2026-06-10","passed","2026-06-10","","test_peers","",""
"","231457","test_upgrade_from_stable","tests.integration","2026-06-10","passed","2026-06-10","","test_upgrade_from_stable","",""
"Test that there is a read-only endpoint in a standalone cluster.","90853","test_no_read_only_endpoint_in_standalone_cluster","tests.integration.relations.pgbouncer_provider","2026-06-10","passed","2026-06-10","","test_pgbouncer_provider","",""
"Test we have the correct pebble services.","576","test_multiple_pebble_services","tests.integration","2026-06-10","passed","2026-06-10","","test_charm","",""
"Test endpoints when pgbouncer-k8s is related to a TLS operator.","141971","test_expose_external_with_tls","tests.integration","2026-06-10","passed","2026-06-10","","test_expose_external","",""
"Deploy Mattermost to test the 'db' relation.

    Mattermost needs TLS enabled on PgBouncer to correctly connect to it.

    Args:
        ops_test: The ops test framework
    ","189479","test_mattermost_db","tests.integration","2026-06-10","passed","2026-06-10","","test_tls","",""
"Simple test to ensure that the PostgreSQL and application charms get deployed.","344085","test_deploy_latest","tests.integration","2026-06-10","passed","2026-06-10","","test_upgrade","",""
"Simple test to ensure that the PostgreSQL and application charms get deployed.","223904","test_deploy_stable","tests.integration","2026-06-10","passed","2026-06-10","","test_upgrade_data_integrator","",""
"Test the deployment of the charm.","146958","test_trust","tests.integration","2026-06-10","passed","2026-06-10","","test_trust","",""
"Verify that logs will be rotated.","726","test_logrotate","tests.integration","2026-06-10","passed","2026-06-10","","test_charm","",""
"","179446","test_pgbouncer_stable_when_deleting_postgres","tests.integration.relations","2026-06-10","passed","2026-06-10","","test_backend_database","",""
"Test that two different applications connect to the database with different credentials.","96389","test_each_relation_has_unique_credentials","tests.integration.relations.pgbouncer_provider","2026-06-10","passed","2026-06-10","","test_pgbouncer_provider","",""
"Removes the TLS relation and check through the test app the it is off.

    Args:
        ops_test: The ops test framework
    ","27425","test_remove_tls","tests.integration","2026-06-10","passed","2026-06-10","","test_tls","",""
"","190480","test_multiple_pgb_can_connect_to_one_backend","tests.integration.relations.pgbouncer_provider","2026-06-10","passed","2026-06-10","","test_pgbouncer_provider","",""
"Test updating from stable channel.","168250","test_upgrade_from_stable","tests.integration","2026-06-10","passed","2026-06-10","","test_upgrade_data_integrator","",""
"Scale down PGB while TLS is enabled.

    Args:
        ops_test: The ops test framework
    ","71135","test_scale_down_pgb","tests.integration","2026-06-10","passed","2026-06-10","","test_tls","",""
"Check we can update and delete things.","1022","test_database_usage","tests.integration.relations.pgbouncer_provider","2026-06-10","passed","2026-06-10","","test_pgbouncer_provider","",""
"Build and deploy one unit of PostgreSQL and then test config with wrong parameters.","120221","test_config_parameters","tests.integration","2026-06-10","passed","2026-06-10","","test_config","",""
"Test that there is read-only endpoint in a scaled up cluster.","77083","test_read_only_endpoint_in_scaled_up_cluster","tests.integration.relations.pgbouncer_provider","2026-06-10","passed","2026-06-10","","test_pgbouncer_provider","",""
"Test the relation blocks with extensions.","161903","test_extensions_blocking","tests.integration.relations","2026-06-10","passed","2026-06-10","","test_db","",""
"Build and deploy pgbouncer charm.","58202","test_build_and_deploy","tests.integration","2026-06-10","passed","2026-06-10","","test_charm","",""
"Test that the pre-upgrade-check action runs successfully.","1085","test_pre_upgrade_check","tests.integration","2026-06-10","passed","2026-06-10","","test_upgrade_data_integrator","",""
"Test updating charm config updates pgbouncer config & relation data.","21770","test_config_updates","tests.integration","2026-06-10","passed","2026-06-10","","test_charm","",""
"","126251","test_legacy_relation_compatibility","tests.integration.relations.pgbouncer_provider","2026-06-10","passed","2026-06-10","","test_pgbouncer_provider","",""
"Test the expose-external config option.","210208","test_expose_external","tests.integration","2026-06-10","passed","2026-06-10","","test_expose_external","",""
"Test that the pgbouncer and postgres charms can relate to one another.","277288","test_relate_pgbouncer_to_postgres","tests.integration.relations","2026-06-10","passed","2026-06-10","","test_backend_database","",""
"Check we can read things in readonly.","1023","test_readonly_reads","tests.integration.relations.pgbouncer_provider","2026-06-10","passed","2026-06-10","","test_pgbouncer_provider","",""
"Test that an application can request additional databases using the same interface.","65633","test_an_application_can_request_multiple_databases","tests.integration.relations.pgbouncer_provider","2026-06-10","passed","2026-06-10","","test_pgbouncer_provider","",""
"Test data is replicated to new units after a scale up.","89837","test_scaling","tests.integration.relations","2026-06-10","passed","2026-06-10","","test_peers","",""
"Test that the user is removed when the relation is broken.","42734","test_relation_broken","tests.integration.relations.pgbouncer_provider","2026-06-10","passed","2026-06-10","","test_pgbouncer_provider","",""
"Check version is accurate.","1202","test_database_version","tests.integration.relations.pgbouncer_provider","2026-06-10","passed","2026-06-10","","test_pgbouncer_provider","",""
"Tests deploying and relating to the Indico charm.","295670","test_indico_database","tests.integration.relations.pgbouncer_provider","2026-06-10","passed","2026-06-10","","test_pgbouncer_provider","",""
"Test that the pre-upgrade-check action runs successfully.","3313","test_pre_upgrade_check","tests.integration","2026-06-10","passed","2026-06-10","","test_upgrade","",""
"Build and deploy pgbouncer charm.","314807","test_build_and_deploy","tests.integration","2026-06-10","passed","2026-06-10","","test_tls","",""
"Test admin permissions.","2040","test_database_admin_permissions","tests.integration.relations.pgbouncer_provider","2026-06-10","passed","2026-06-10","","test_pgbouncer_provider","",""
"Test that the pgbouncer and postgres charms can relate to one another.","546478","test_create_db_legacy_relation","tests.integration.relations","2026-06-10","passed","2026-06-10","","test_db","",""
"Test that the pre-upgrade-check action runs successfully.","2295","test_pre_upgrade_check","tests.integration","2026-06-10","passed","2026-06-10","","test_upgrade_from_stable","",""
"Check we can't write in readonly.","1020","test_cant_write_in_readonly","tests.integration.relations.pgbouncer_provider","2026-06-10","passed","2026-06-10","","test_pgbouncer_provider","",""
"Scale up PGB while TLS is enabled.

    Args:
        ops_test: The ops test framework
    ","113805","test_scale_up_pgb","tests.integration","2026-06-10","passed","2026-06-10","","test_tls","",""
"","305044","test_tls_encrypted_connection_to_postgres","tests.integration.relations","2026-06-10","passed","2026-06-10","","test_backend_database","",""
"","198220","test_upgrade_from_edge","tests.integration","2026-06-10","passed","2026-06-10","","test_upgrade","",""
"Test that the pgbouncer and postgres charms can relate to one another.","354845","test_scaled_relations","tests.integration.relations","2026-06-10","passed","2026-06-10","","test_peers","",""
"","243916","test_fail_and_rollback","tests.integration","2026-06-10","passed","2026-06-10","","test_upgrade","",""
"Tests that the connection is possible after the pod is deleted.","114965","test_connection_is_possible_after_pod_deletion","tests.integration.relations.pgbouncer_provider","2026-06-10","passed","2026-06-10","","test_pgbouncer_provider","",""
"Test that the charm can be related to the data integrator without extra user roles.","119511","test_relation_with_data_integrator","tests.integration.relations.pgbouncer_provider","2026-06-10","passed","2026-06-10","","test_pgbouncer_provider","",""
